title,released,gf_score,metascore,genre,description,cover_art_url
Fire Pro Wrestling,2001-06-10,3.86,80,Sports,"Fire Pro Wrestling (ファイヤープロレスリング Faiyā Puro Resuringu) is a professional wrestlingvideo game series originating from Japan, starting in 1989 by Human Entertainment, and developed and owned by Spike Chunsoft. The series is distinguished by its grappling system, which is primarily based on timed button presses and strategy. Another signature feature of the series is its Edit mode, a character creation feature with many options to customize appearances, wrestling moves and character A.I.behavior.",https://gamefaqs.akamaized.net/box/1/3/2/13132_front.jpg
Donkey Kong Country 3,2005-11-07,3.86,77,Action,"Donkey Kong Country 3: Dixie Kong's Double Trouble!, released in Japan as Super Donkey Kong 3: Nazo no Kremis Shima (スーパードンキーコング３ 謎のクレミス島, Super Donkey Kong 3: Mysterious Kremis Island)is an adventure platformvideo game developed by Rare and published by Nintendo for the Super Nintendo Entertainment System (SNES). It was released on November 22, 1996, in North America, on November 23, 1996 in Japan, and on December 13, 1996 in Europe and Australia. It is the third installment of the Donkey Kong Country series and serves as a direct sequel to Donkey Kong Country 2: Diddy's Kong Quest. It was also re-released for the Game Boy Advance (GBA) in 2005. The game was made available to download on the Wii's Virtual Console service in 2007, as well as for the Wii U's Virtual Console in 2014.",https://gamefaqs.akamaized.net/box/4/9/7/68497_front.jpg
The Lord of the Rings: The Return of the King,2003-11-05,3.86,77,Role-Playing,"The Lord of the Rings: The Return of the King is a 2003 action/hack and slash video gamedeveloped by EA Redwood Shores for the PlayStation 2 and Windows. It was ported to the GameCubeand Xbox by Hypnos Entertainment, to the Game Boy Advance by Griptonite Games, to mobile by JAMDAT, and to OS X by Beenox. The game was published by Electronic Arts. It is the sequel to the 2002 game The Lord of the Rings: The Two Towers.",https://gamefaqs.akamaized.net/box/8/3/6/18836_front.jpg
Double Dragon Advance,2003-11-14,3.84,75,Action,Double Dragon Advance is a 2003 side-scrolling beat-em-upreleased for the Game Boy Advance. It was published by Atlus and developed by Japanese studio Million. It is a remake of the 1987arcade game Double Dragon and incorporates elements from its sequels and home versions.,https://gamefaqs.akamaized.net/box/6/2/5/55625_front.jpg
Yggdra Union: We'll Never Fight Alone,2006-11-21,3.84,77,Strategy,"Yggdra Union: We'll Never Fight Alone is a tactical role-playing gamefor the Game Boy Advanceand PlayStation Portable, developed by Sting Entertainment as the second episode of the Dept. Heaven saga of games. Atlus USAlocalized and published both versions of the game in North America. 505 Games published the Game Boy Advance version in a limited number of European countries, such as Italy and France. A Nintendo DS side-game was released in Japan on December 3, 2009 as Yggdra Unison: Seiken Buyuuden.",https://gamefaqs.akamaized.net/box/0/7/7/72077_front.jpg
DOOM II,2002-10-28,3.83,77,Action,"Doom II (full title Doom II: Hell on Earth) is a first-person shooter video game, the second title of id Software's Doomfranchise. It was originally released for MS-DOS computers in 1994 and Macintosh computers in 1995. Unlike Doom, which was initially only available through shareware and mail order, Doom II was a commercial release sold in stores. Master Levels for Doom II, an expansion pack that includes 21 new levels, was released on December 26, 1995 by id Software.",https://gamefaqs.akamaized.net/box/0/6/8/3068_front.jpg
Klonoa 2: Dream Champ Tournament,2005-02-23,3.83,78,Action,"Klonoa 2: Dream Champ Tournament known in Japan as Kaze no Klonoa G2: Dream Champ Tournament ( 風のクロノアG2 ドリームチャンプ・トーナメント), is a video game published by Namcoand released on the Game Boy Advance in Japan in 2002 and North America in early 2005. As the third game in the Klonoahandheld series, the game retains many of the gameplay elements of the previous titles, while adding in a few of its own.",https://gamefaqs.akamaized.net/box/5/8/5/20585_front.jpg
Dr. Mario / Puzzle League,2005-11-28,3.82,74,Puzzle,"Puzzle League, known as Paneru de Pon in Japan, is a series of video games published by Nintendo for its various video game consoles. The series began with Panel de Pon in Japan, named Tetris Attack in North America, and has since been adapted to many other consoles. The core gameplay of each version is the same in each game, but branding, presentation details and console-specific features have varied.",https://gamefaqs.akamaized.net/box/5/1/5/70515_front.jpg
Super Street Fighter II Turbo: Revival,2001-10-30,3.81,84,Action,"Super Street Fighter II Turbo (also known as Super Street Fighter II Turbo: The Ultimate Championship) is a competitive fighting gamereleased for the arcades by Capcom in 1994 in Japan on February 23, 1994, North America on February 23, 1994 And March 26, 1994 (Beta) and Europe on 1994. It is the fifth installment in the Street Fighter II sub-series of Street Fighter games, following Super Street Fighter II: The New Challengers. Like its predecessor, it ran on the CP System II hardware.",https://gamefaqs.akamaized.net/box/3/1/8/13318_front.jpg
Sonic Advance 3,2004-06-07,3.81,79,Action,"Sonic Advance 3 is a 2004 platform video gamedeveloped by Dimps and Sonic Team for the Game Boy Advance. It is part of the Sonic the Hedgehogseries, and the sequel to Sonic Advance 2. The game stars the characters Sonic, Tails, Amy, Knuckles, and Cream as they seek to keep Doctor Eggman and his robot assistant Gemerl from building empires on each of seven chunks Eggman has divided the Earth into.",https://gamefaqs.akamaized.net/box/3/3/7/57337_front.jpg
Medabots: Metabee,2003-03-31,3.81,,Role-Playing,"Medabots: Metabee and Medabots: Rokusho (メダロット弐CORE クワガタバージョン・カブトバージョン Medarotto Ni CORE Kabuto Bājon · Kuwagata Bājon) is a set of two 2D top-down role-playing video games in the Medabotsseries, developed by Natsume and published by Imagineer for Game Boy Advance. It is a remake of the 1999 title Medarot 2(メダロット２ Medarotto 2). Although Medarot 2 was released exclusively in Japan, Medabots was released in other regions. It was later re-released on Wii U Virtual Console.",https://gamefaqs.akamaized.net/box/3/0/0/54300_front.jpg
Konami Krazy Racers,2001-06-10,3.8,78,Racing,"Konami Krazy Racers(Konami Wai Wai Racing Advance in Japan; Krazy Kart Racing for mobile) is a kart racing video game published and developed by Konami for the Game Boy Advancehandheld video game console, iOS and Android. It was first released in Japan, and was later released in North Americaand some PAL regions. It was also re-released for Wii U Virtual Console on October 15, 2015 in Europe. It was a launch game for the system. Konami Krazy Racersmakes use of a variety of characters and concepts from several of Konami's franchises, including Castlevania, Metal Gear, and Gradius. It plays similarly to the Mario Kartseries, with eight characters per circuit and offensive/defensive items placed at predetermined points in the tracks.",https://gamefaqs.akamaized.net/box/1/3/5/13135_front.jpg
Densetsu no Starfy,2002-09-06,3.8,,Action,Densetsu no Stafy is a platform video gamedeveloped by Tose and published by Nintendo for the Nintendo Game Boy Advance exclusively in Japan. It is the first game in the series The Legendary Starfy.,https://gamefaqs.akamaized.net/box/2/7/6/11276_front.jpg
The King of Fighters EX2: Howling Blood,2003-12-11,3.8,80,Action,"The King of Fighters EX2: Howling Blood is a fighting game released by Playmore, MMV and Sun-Tec for the Gameboy Advance. It is based on The King of Fighters 2000 and is the sequel of The King of Fighters EX. It was also ported for the N-Gage as The King of Fighters Extreme.",https://gamefaqs.akamaized.net/box/1/6/7/44167_front.jpg
Medabots AX: Rokusho Ver.,2002-06-27,3.8,,Action,"Medabots AX: Metabee version and Medabots AX: Rokusho version are spin-off fighting games of the Medabots series, developed and published by Natsume.",https://gamefaqs.akamaized.net/box/1/3/5/16135_front.jpg
Super Mario Advance,2001-06-10,3.79,84,Action,"On March 21, 2001, Super Mario Bros. 2 received another release, based on the All-Stars remake, as part of Super Mario Advance, which also contains a remake of Mario Bros.. Super Mario Advance was developed by Nintendo Entertainment Analysis and Development, and was a launch title for the Game Boy Advance. The Super Mario Advance version of Super Mario Bros. 2 includes several new features such the addition of the enemy Robirdo, a robotic Birdo, replacing Mouser as the boss of World 3; the addition of the Yoshi Challenge, in which players may revisit stages to search for Yoshi Eggs; and a new point-scoring system, similar to that used in the aforementioned BS Super Mario USA Power Challenge. Graphical and audio enhancements appear in the form of enlarged sprites, multiple hit combos, digital voice acting, and such minor stylistic and aesthetic changes as an altered default health-meter level, boss-order, backgrounds, the size of hearts, Princess Toadstool being renamed to the now-standard ""Princess Peach"", and the inclusion of a chime to announce Stars. The game was released for the Wii U Virtual Console on July 16, 2014, in Japan and later in North America on November 6, 2014.",https://gamefaqs.akamaized.net/box/5/3/2/12532_front.jpg
Tales of Phantasia,2006-03-06,3.79,76,Role-Playing,"The Game Boy Advance release marked the first official English-language appearance of Tales of Phantasia, which was met with mostly positive reception in the West, earning a 73% average from GameRankings and 76 out of 100 rating from Metacritic. While websites such as GameSpot felt that the game distinguished itself from other role-playing titles with its action-based combat system, it also overly-relied on too many random battles to ""drag down the pacing and pad out the playing time"". IGN commented that the battle system was unrefined when compared to later games in the series such as Tales of Symphonia on the GameCube, but that the graphic and audio quality held up ""relatively well"" eleven years after its original release. The site would also call the story and characters ""amazing"", but that its dated design would only appeal to players familiar with older games in the genre, calling it a ""love/hate"" experience. Editors of Electronic Gaming Monthly similarly remarked that ""fans of traditional RPGs will appreciate its long, varied dungeons and action-packed, real-time battles,"" and that it ""still has an awful lot of charm for such an old game"". Eurogamer expressed that the title's late release near the end of the handheld's life hurt it when compared to similar ports on Sony's PlayStation Portable, and that the game's ""messy"" interface and ""rough around the edges"" localization paled in comparison to the Super Famicom's unofficial fan translation.",https://gamefaqs.akamaized.net/box/6/4/7/43647_front.jpg
Summon Night Craft Sword Monogatari: Hajimari no Ishi,2005-12-08,3.78,,Role-Playing,Summon Night Craft Sword Monogatari: Hajimari no Ishi (サモンナイト クラフトソード物語 はじまりの石 Samon Naito Kurafutosōdo Monogatari Hajimari no Ishi) is an action role-playing game by Flight-Plan for the Game Boy Advance.,https://gamefaqs.akamaized.net/box/6/9/6/71696_front.jpg
Ninja Five-O,2003-04-22,3.78,82,Action,"Ninja Five-O, known in the PAL region as Ninja Cop, is an action platform video game developed by Hudson Soft and published by Konami. It was released for the Game Boy Advancein North America and Europe in April 2003. Players take the role of Joe Osugi, a ninja who must stop a terrorist group influenced by mystical masks. It was first announced at ""Konami Gamers' Day"" in early 2003.",https://gamefaqs.akamaized.net/box/2/1/5/52215_front.jpg
Zoids: Legacy,2004-09-15,3.78,,Role-Playing,"Zoids Saga II was released in several English-speaking nations, under the title of Zoids: Legacy. There were no changes to the gameplay, but the entire game was translated from Japanese to English. This translation is mostly inaccurate, incorrect most of the time and nonsensical at others, with numerous spelling and grammar errors. It is cited as one of the major problems of the English-language release.",https://gamefaqs.akamaized.net/box/0/5/1/57051_front.jpg
Combo Pack: Sonic Advance + Sonic Pinball Party,2005-11-16,3.78,,Miscellaneous,"Sonic Pinball Party (ソニック ピンボール パーティー Sonikku Pinbōru Pātī?) is a pinball-themed video game in the Sonic the Hedgehog series released for the Game Boy Advance in 2003. Developed by Jupiter and Sonic Team, the game is a spin-off title featuring references to other games developed by Sonic Team. Sonic the Hedgehog, NiGHTS into Dreams and Samba de Amigo are the most prominent franchises featured, along with characters from Burning Rangers, Phantasy Star Online and Chu-Chu Rocket.",https://gamefaqs.akamaized.net/box/9/5/4/71954_front.jpg
TMNT,2007-03-20,3.77,80,Action,"TMNT is a single-playeraction-adventure multi-platform action gamestarring the Teenage Mutant Ninja Turtles. It is based on the 2007 film of the same name, and was released three days before the actual movie's release for the Xbox 360, Wii, PlayStation 2, Nintendo GameCube, Nintendo DS, and PlayStation Portable, as well as for the PC on March 20, 2007.",https://gamefaqs.akamaized.net/box/5/3/0/78530_front.jpg
Monster Rancher Advance 2,2002-11-17,3.77,79,Strategy,Monster Rancher Advance 2 (known in Japan as Monster Farm Advance 2 (モンスターファーム アドバンス 2Monsutā Fāmu Adobansu Tsū)) is the second of the Monster Rancher games to be released on Game Boy Advance. It is the sequel to Monster Rancher Advance.,https://gamefaqs.akamaized.net/box/8/8/3/18883_front.jpg
Dragon Ball Z: The Legacy of Goku II,2003-06-17,3.77,75,Role-Playing,"Dragon Ball Z: The Legacy of Goku II was released on June 17, 2003 in North America and by Infogrames. The plot of the game picks up where The Legacy of Goku left off, and continues until the end of the Cell Games Saga when Gohan defeats the evil android Cell. The game introduced several new concepts to the series. The first was transformations, which allowed characters to become temporarily stronger, at the cost of slowly draining their energy. It also introduced the scouter, which allowed players to look up the stats of other characters in the game, as well as basic information about them. The game also introduced charged melee attacks, which allowed characters to unleash a powerful physical strike after a short charging period. The game also allowed characters to further supplement their stats with capsules that were scattered around the game world. Despite being titled ""The Legacy of Goku"" this game featured the most limited play as Goku, with players starting play as Gohan and gradually unlock Piccolo, Vegeta, Trunks and finally Goku as playable characters. Once the story is completed players can no longer play as Goku, but will be able to continue playing as the others to unlock a final playable character, Mister Satan/Hercule in order to unlock an alternate ending to the game.",https://gamefaqs.akamaized.net/box/8/4/4/52844_front.jpg
Medabots: Rokusho,2003-03-31,3.76,,Role-Playing,"Medabots (known as Medarot 2 CORE (メダロット弐CORE) in Japan) is a 2D top-down RPG developed by Natsume and published by Imagineer for the Game Boy Advance. It was released first in Europe, then in North America and last in Japan. It is a remake of the Japan-only Game Boy game ""Medarot 2"".",https://gamefaqs.akamaized.net/box/3/0/3/54303_front.jpg
Classic NES Series: Metroid,2004-10-25,3.76,58,Action Adventure,"Metroid is an action-adventure game developed and published by Nintendo. The first installment in the Metroid series, it was originally released in Japan for the Family Computer Disk System peripheral in August 1986. North America received a release in August 1987 on the Nintendo Entertainment System in a ROM cartridgeformat, with the European release following in January 1988. Set on the planet Zebes, the story follows Samus Aran as she attempts to retrieve the parasitic Metroid organisms that were stolen by Space Pirates, who plan to replicate the Metroids by exposing them to beta raysand then use them as biological weapons to destroy Samus and all who oppose them.",https://gamefaqs.akamaized.net/box/6/0/9/14609_front.jpg
Dragon Ball Z: The Legacy of Goku I & II,2005-12-08,3.76,,Miscellaneous,"Dragon Ball Z: The Legacy of Goku is a series of video games for the Game Boy Advance, based on the anime series Dragon Ball Z. All three games are action role-playing games. The first game, Dragon Ball Z: The Legacy of Goku was developed by Webfoot Technologies and released in 2002. The game was followed by two sequels: Dragon Ball Z: The Legacy of Goku II released in 2003, and Dragon Ball Z: Buu's Fury released in 2004. In 2016, Webfoot Technologies announced the start of development of another sequel.",https://gamefaqs.akamaized.net/box/9/7/1/71971_front.jpg
Game & Watch Gallery 4,2002-10-28,3.76,71,Miscellaneous,"Game & Watch Gallery 4, known as Game & Watch Gallery Advance in Europe and Australia, is the fourth in a series of compilations of the classic Game & Watch games made between 1980 and 1991. Like the previous incarnations in the series, the featured games have both Classic modes, which attempt to recreate the look of the original units as faithfully as possible, and Modern modes, which feature Mariocharacters along with all-new graphics, all-new gameplay, and music. It is the first and only game in the series to be on the Game Boy Advance.",https://gamefaqs.akamaized.net/box/2/6/8/18268_front.jpg
Mega Man Battle Network,2001-10-30,3.76,79,Role-Playing,"Mega Man Battle Network, known in Japan as Rockman.EXE (ロックマンエグゼ Rokkuman Eguze), is one of Capcom's Mega Man series and debuted in 2001 on the Game Boy Advance. It is a RPG spin-off series based on the original Mega Man series, taking place in a separate continuity where computer and networking technology advanced instead of robotics. There are six main Mega Man Battle Network games as well as several side-story games.",https://gamefaqs.akamaized.net/box/5/2/5/12525_front.jpg
Shining Soul II,2004-04-20,3.75,74,Role-Playing,"Shining Soul II is an action role-playing gamefor the Game Boy Advance. It was developed by Nextech and Grasshopper Manufactureand published by Sega in 2003 (Japan), THQ (2004, Europe) and Atlus (2004, America), as the sequel to Shining Soul and part of the Shining series.",https://gamefaqs.akamaized.net/box/2/3/4/52234_front.jpg
Super Puzzle Fighter II,2003-03-31,3.75,83,Puzzle,"Super Puzzle Fighter II Turbo, released in Japan as Super Puzzle Fighter II X (Japanese: スーパーパズルファイターII X), is a one or two player tile-matchingpuzzle video game first released in 1996 by the Capcom Coin-Op division of Capcom on the CPS IIarcade system. The game's title is a parody of Super Street Fighter II Turbo, as there were no other Puzzle Fighter games at the time, and the game includes music and interface elements spoofing the Street Fighter Alphaand Darkstalkers games. It was a response to Sega's Puyo Puyo 2 that had been sweeping the Japanese arcade scene.",https://gamefaqs.akamaized.net/box/8/2/1/7821_front.jpg
Sonic Battle,2004-01-05,3.75,69,Action,"Sonic Battle is a fightingvideo game developed by Sonic Team for the Game Boy Advance. It was published by Sega in Japan and THQ in North America and Europe. It is the second fighting game in the Sonic the Hedgehogseries, the first game being Sonic the Fighters. It was released in Japan in December 2003 and in North America and Europe in early 2004.",https://gamefaqs.akamaized.net/box/1/4/4/53144_front.jpg
Sonic Advance,2002-02-03,3.74,87,Action,"Sonic Advance is a 2001 side-scrolling platform game developed by Dimpsfor the Game Boy Advance(GBA). It was the first Sonic the Hedgehog game to be released on a Nintendo platform and was produced in commemoration of the series' tenth anniversary. The story follows Sonic, Tails, Knuckles, and Amyas they journey to stop Doctor Eggman from taking over the world. Controlling a character, players are tasked with completing each level, defeating Eggman and his robotarmy, and collecting the seven Chaos Emeralds.",https://gamefaqs.akamaized.net/box/2/9/3/14293_front.jpg
Super Ghouls 'n Ghosts,2002-09-23,3.74,78,Action,"Super Ghouls 'n Ghosts is an action side-scrolling platform gamedeveloped and published by Capcom and releasedfor the Super Nintendo Entertainment System in 1991. It is the third game in the Ghosts 'n Goblinsseries. The game was included in the video game compilation Capcom Generations: Chronicles of Arthur for the PlayStationand Sega Saturn, as well as in Capcom Classics Collection for the PlayStation 2 and Xboxand Capcom Classics Collection: Reloaded for the PlayStation Portable. A remake of the game was released for the Game Boy Advance which features an additional game mode with new stages. The original SNES version was released for the Wii Virtual Console and was released for the Wii U Nintendo eShop on May 16, 2013. Nintendo re-released Super Ghouls 'n Ghosts in the United States in September 2017 as part of the company's Super NES Classic Edition.",https://gamefaqs.akamaized.net/box/4/2/2/17422_front.jpg
Sonic Advance 2,2003-03-09,3.74,83,Action,"Sonic Advance 2 is a 2002 side-scrolling platform game developed by Dimpsfor the Game Boy Advance. It is an installment in the Sonic the Hedgehog series and the sequel to 2001's Sonic Advance. The story follows Sonic as he sets out to save his friends and retrieve the seven magical Chaos Emeralds from series antagonist Doctor Eggman. Gameplay consists of the player completing various levels as one of five characters, each with their own unique attributes. After each zone is completed, the player faces Doctor Eggman in a boss battle.",https://gamefaqs.akamaized.net/box/7/3/6/18736_front.jpg
Classic NES Series: Dr. Mario,2004-10-25,3.73,66,Puzzle,Dr. Mario (stylized as D℞. Mario) is a 1990 action puzzle video gameproduced by Gunpei Yokoiand designed by Takahiro Harada. Nintendodeveloped and published the game for the Nintendo Entertainment System and Game Boy consoles. The game's soundtrack was composed by Hirokazu Tanaka.,https://gamefaqs.akamaized.net/box/5/9/3/59593_front.jpg
ChuChu Rocket!,2001-06-10,3.73,84,Puzzle,"ChuChu Rocket! is an action puzzle gamedeveloped by Sonic Teamand published by Sega. Released for the Dreamcast in 1999, it was the first game for the system to support online console gaming. Players must place arrows on a board to lead mice into escape rockets while avoiding cats. The game features single-player modes in which a player must save all the mice on a board, and a multiplayer mode in which players battle to collect the most mice.",https://gamefaqs.akamaized.net/box/3/9/3/2393_front.jpg
The Sims Bustin' Out,2003-12-16,3.72,,Simulation,"The Sims Bustin' Out is a video game that was released in 2004/2003 for the PlayStation 2, Xbox, Nintendo GameCube, Game Boy Advance, & N-Gage. It is the second title in The Sims console series and the first The Sims title not released on Windows PC. It featured the same 3D environment and engine the past game did, however adds several features from The Simsexpansion packs: The Sims: Hot Date, The Sims: Superstar, and The Sims: Livin' Large. As the titlesuggests, the sims can get out of the house to visit other locations such as Shiny Things Lab or Casa Caliente. There are two modes. Bust Out Mode, which has mission-based gameplay and Freeplay Mode, which is open-ended gameplay very much like the original The Sims PC game. The PS2 version once featured the option to play online. However, it was shut down on August 1, 2008 (the same day The Sims Online shut down).",https://gamefaqs.akamaized.net/box/4/8/6/53486_front.jpg
Phantasy Star Collection,2002-11-24,3.72,76,Miscellaneous,"Phantasy Star is a role-playing video game (RPG) developed by Sega and released for the Master System in 1987. One of the earliest Japanese RPGs for consoles, Phantasy Startells the story of Alis on her journey to defeat the evil ruler of her star system, King Lassic, after her brother dies at his hands. She traverses between planets, gathering a party of fighters and collecting the items she needs to avenge her brother's death and return peace to the star system. The gameplay features traditional Japanese RPG elements including random encounters and experience points. All the characters have predefined personalities and abilities, a unique element compared to the customizable characters of other RPGs of the era.",https://gamefaqs.akamaized.net/box/1/2/7/17127_front.jpg
Yu-Gi-Oh! GX: Duel Academy,2006-01-10,3.72,67,Strategy,"Yu-Gi-Oh! GX: Duel Academy, known as Yu-Gi-Oh Duel Monsters GX: Mezase Duel King (Yu-Gi-Oh! Duel Monsters GX: Aim to be Duel King!) in Japan, is a video game released for the GameBoy Advance console from Nintendo on January 10, 2006. This is the first Yu-Gi-Oh! GX video game released.",https://gamefaqs.akamaized.net/box/2/1/9/69219_front.jpg
